number,value,datetime_start,datetime_complete,duration,params_ema_decay,params_fitness_0,params_fitness_1,params_fitness_2,params_logit_adjust_tau,params_lr,params_lr_decay,params_reputation_0,params_reputation_1,params_reputation_2,params_sel_gumbel_scale,params_sel_priority_0,params_sel_priority_1,params_sel_static_blend,params_server_momentum,params_utility_0,params_utility_1,params_utility_2,params_utility_3,state
47,-inf,2026-08-26 03:40:52.955250,2026-08-26 03:40:53.220845,0 days 00:00:00.265595,0.2586014406544615,0.06708504533598636,0.5140765610112831,0.9889853242400091,1.5469196218634755,0.058206364297224214,cosine,0.9436109079838985,0.5763842465924888,0.8605315596608709,1.020432249839106,0.7645222372563184,0.654689276748143,0.31850783729277193,0.33534632127170694,0.782697270344364,0.4181023409248242,0.7428907918086345,0.4214985154930678,COMPLETE
48,-inf,2026-08-26 03:40:53.235187,2026-08-26 03:40:53.498775,0 days 00:00:00.263588,0.18754015731206564,0.3337868187180246,0.17789729927765693,0.7943714214128074,0.7014201710020259,0.02423140559920671,none,0.730908459103689,0.4376661770741768,0.7070285081548235,1.1907763208484834,0.69388546751068,0.519855271837896,0.3856295480642836,0.5159927842730997,0.9980260819319897,0.5002633947867875,0.26731538441895264,0.3340207523238745,COMPLETE
49,-inf,2026-08-26 03:40:53.512975,2026-08-26 03:40:53.772166,0 days 00:00:00.259191,0.2363497089845618,0.40138060979350765,0.2369336948850271,0.743962049035318,0.9238956457280116,0.07597959702405752,cosine,0.9214551665209634,0.21280650508486734,0.5937712934840926,1.061758129187659,0.5303367349348642,0.8411580734255876,0.7423524044783425,0.2773692146330466,0.8248487421818206,0.05886765468719632,0.06548854422868011,0.2086514440099222,COMPLETE
