number,value,datetime_start,datetime_complete,duration,params_ema_decay,params_fitness_0,params_fitness_1,params_fitness_2,params_logit_adjust_tau,params_lr,params_lr_decay,params_reputation_0,params_reputation_1,params_reputation_2,params_sel_gumbel_scale,params_sel_priority_0,params_sel_priority_1,params_sel_static_blend,params_server_momentum,params_utility_0,params_utility_1,params_utility_2,params_utility_3,state
0,-inf,2026-08-26 03:40:37.185961,2026-08-26 03:40:40.190492,0 days 00:00:03.004531,0.1534384394089944,0.10628951138709705,0.08814398781886747,0.9162467583170726,0.5097034266131331,0.05581623903601119,none,0.8453029739700328,0.6372430420499291,0.9667556526996889,0.7023825268408327,0.6910945772510071,0.557228689035881,0.45171256489658707,0.38221821956636703,0.6914245407150158,0.27223700827340985,0.08852288089776965,0.8368038865527851,COMPLETE
1,-inf,2026-08-26 03:40:40.217382,2026-08-26 03:40:40.452764,0 days 00:00:00.235382,0.1944063181796277,0.4348889569322351,0.41885062800376155,0.557637257075241,1.9050455649143145,0.015237984230966338,cosine,0.7966345752154435,0.6376400066319065,0.20303038187881628,1.2046772988647638,0.7334685868038651,0.1835278498743411,0.27792740215725376,0.6424639231606589,0.9486064288523652,0.6862534428643441,0.7963935675121939,0.3486776449730831,COMPLETE
2,-inf,2026-08-26 03:40:40.467048,2026-08-26 03:40:40.681333,0 days 00:00:00.214285,0.4341373162764832,0.5842294806453866,0.38360527850167775,0.26559065163767265,1.7449112980424788,0.05281612149262945,none,0.7338457334080435,0.23178030075537498,0.19014993991064832,0.10323036037321276,0.8642302449080093,0.01740633748865207,0.4295019347134119,0.3858191398487169,0.9860009131041784,0.8898664948508893,0.9275481653966224,0.5159506817169813,COMPLETE
3,-inf,2026-08-26 03:40:40.696049,2026-08-26 03:40:40.911254,0 days 00:00:00.215205,0.39005672347118325,0.9598108395141801,0.7504955591580855,0.7786361172933096,1.2005345140971604,0.039583467106051755,cosine,0.54620238256189,0.2816583839382758,0.604410148290641,0.7836161925324996,0.6588535525131096,0.6312145010363495,0.2044116350588131,0.7400007601169547,0.7200330938686784,0.14364392438426116,0.5917890702067676,0.22544932525983316,COMPLETE
4,-inf,2026-08-26 03:40:40.925803,2026-08-26 03:40:41.140481,0 days 00:00:00.214678,0.4646800788203644,0.13474250880900535,0.3513186425279026,0.8251136338118537,1.5906963140197734,0.010438874662458337,cosine,0.9100776441733935,0.4671212499303101,0.6206344899838625,1.3281865675034075,0.5025716485278,0.7030903757282377,0.08031094556868823,0.39421750107760556,0.8517361877678884,0.5466560113174629,0.4822334568563627,0.014379275048976226,COMPLETE
5,-inf,2026-08-26 03:40:41.154639,2026-08-26 03:40:41.350996,0 days 00:00:00.196357,0.08215775058866336,0.9163227057652289,0.21362056145404235,0.8238749359207135,1.0091297345231802,0.08632729924331614,cosine,0.6638579725747412,0.939004056510684,0.4924005199050007,1.2367603407241896,0.02309736520882609,0.9948589095830865,0.9539267900488753,0.9624974182719349,0.11515791668833145,0.3749775739762529,0.533406230775854,0.7537340873771835,COMPLETE
6,-inf,2026-08-26 03:40:41.365166,2026-08-26 03:40:41.628735,0 days 00:00:00.263569,0.3458302362016668,0.8489065376088546,0.06036524685822052,0.7547067205260087,1.8290567189296403,0.07026037313438552,none,0.5003934141244193,0.042163437960396684,0.5637421894324698,0.9016727873549764,0.6270064231567571,0.19067689335311006,0.9920748923114991,0.7423740014999465,0.5088441596801734,0.3479671474854955,0.30922951456208075,0.7860690267490109,COMPLETE
7,-inf,2026-08-26 03:40:41.643029,2026-08-26 03:40:41.856115,0 days 00:00:00.213086,0.5732714720482854,0.7364050559436428,0.1946868775943705,0.3151157444383798,0.13789012458628136,0.025319366364340238,cosine,0.6433155798139151,0.15149900808159256,0.4406445347755712,0.25156703436948175,0.05694481622693322,0.036315878671245125,0.4042831605342945,0.9250565122238582,0.5178335570283868,0.8483961575468857,0.8753735685269144,0.38662856026923625,COMPLETE
8,-inf,2026-08-26 03:40:41.870500,2026-08-26 03:40:42.082798,0 days 00:00:00.212298,0.6422101985445717,0.8285765082663962,0.9574955585187457,0.2860314631100678,0.9320777967335208,0.0023557670082804535,sqrt,0.41253100630816614,0.9647291674412579,0.7158837872752977,0.14693391739755235,0.20392991123283927,0.9097596231969721,0.756337625802015,0.9163049316705328,0.17704809153538778,0.37178371509207647,0.9283931395804667,0.13330363527326441,COMPLETE
9,-inf,2026-08-26 03:40:42.097318,2026-08-26 03:40:42.304271,0 days 00:00:00.206953,0.5977280029917654,0.9373653162603426,0.43134029194397094,0.8617166571543653,0.8619276119668235,0.038825970107867515,sqrt,0.6754039905165931,0.2248394831071005,0.01735406257788623,1.2881908850393544,0.3946638625452677,0.14965129423438892,0.5866653352456319,0.9895503302477074,0.7535363669307398,0.08178472837872855,0.5144900322697611,0.22918698075326357,COMPLETE
10,-inf,2026-08-26 03:40:42.318447,2026-08-26 03:40:42.570660,0 days 00:00:00.252213,0.8883299927624106,0.05229836963184771,0.051934590501062916,0.015152735117307414,0.32858702733677037,0.004510488884214141,none,0.173502011157447,0.689699038149946,0.9749362724629933,0.4821490002360321,0.9945476200958391,0.3867890177818604,0.6038446375711652,0.1339093434820059,0.26848533716955986,0.041618187410548096,0.019936411217026773,0.9874275136187765,COMPLETE
11,-inf,2026-08-26 03:40:42.592890,2026-08-26 03:40:42.872676,0 days 00:00:00.279786,0.048520297986749145,0.28701269348000036,0.5947472763135764,0.6082031700760419,1.982565045197607,0.016290556822456826,none,0.9945522127731357,0.6566301818146814,0.9204920746808576,0.9783595055628684,0.7878570898520636,0.40839405704347675,0.28309394233927226,0.577503830283065,0.9462576963159924,0.6647063556475066,0.04014821688479845,0.49965078893407333,COMPLETE
12,-inf,2026-08-26 03:40:42.886951,2026-08-26 03:40:43.142115,0 days 00:00:00.255164,0.20701626487351435,0.387611618400004,0.5825127328989559,0.9956068401673211,0.45452810024521995,0.017992255487984877,cosine,0.8668347328218338,0.5790665274418834,0.351107491066986,0.6127880132626919,0.7311676049217881,0.33879343745385715,0.04486771294673364,0.24992856533303429,0.6611246178796434,0.6949494166157567,0.7598817176258,0.6359487982000391,COMPLETE
13,-inf,2026-08-26 03:40:43.156309,2026-08-26 03:40:43.417379,0 days 00:00:00.261070,0.21450050662006717,0.23153863008041226,0.23677604303697092,0.5869862483831905,1.4369770048082624,0.00653999508870111,none,0.8117355448009749,0.7643228351289716,0.8232599334290558,1.4792245512821487,0.5899575905022125,0.5385576145876357,0.30473326259095807,0.03676055551261881,0.839056889955843,0.960450936047858,0.19661707484823443,0.9870566110006793,COMPLETE
14,-inf,2026-08-26 03:40:43.431562,2026-08-26 03:40:43.695503,0 days 00:00:00.263941,0.013050919799679428,0.4583958938267222,0.043276214788950454,0.9721120619129213,0.5356246127889099,0.09810001710495306,sqrt,0.9606900813625071,0.46125941985431207,0.780213456124111,1.0685654173569856,0.83133246429297,0.2678795231464648,0.4995485768490559,0.5582027686306943,0.6267278695335896,0.2436027533250566,0.7239255638827551,0.42316550887973037,COMPLETE
15,-inf,2026-08-26 03:40:43.710064,2026-08-26 03:40:43.958229,0 days 00:00:00.248165,0.2191833282140147,0.5863607506687808,0.4999835962456049,0.638719149106423,1.390261713836771,0.0010021808413770764,cosine,0.820456003425575,0.7942705979247138,0.33073666611138486,0.6853875733318662,0.49466131978439964,0.49354300612713,0.18516059769508697,0.45386324851305904,0.8473542228284572,0.5280407251236975,0.3508152545192097,0.6410178500338386,COMPLETE
16,-inf,2026-08-26 03:40:43.972606,2026-08-26 03:40:44.243180,0 days 00:00:00.270574,0.1441418424115063,0.011907556915788708,0.3083113631277668,0.5055529218334069,0.5692363679943065,0.02794698172311201,none,0.7966649283753295,0.553641577036068,0.9123246770516051,1.05634038895876,0.9177435024153779,0.2049588364323136,0.3779061241209368,0.21379884795564458,0.3684282996756697,0.21353069380474293,0.6958753562817237,0.32578483223197713,COMPLETE
17,-inf,2026-08-26 03:40:44.265726,2026-08-26 03:40:44.536014,0 days 00:00:00.270288,0.2899753593959687,0.2902094884250785,0.14145942175366527,0.7112289217046892,0.7511048382621895,0.012919440816642442,none,0.8995180018553194,0.4285532659028114,0.6920418949374468,0.8414385794670897,0.7396059749914334,0.3151101233339392,0.16048166018972643,0.30597505113229584,0.6042186954656554,0.6916587490902373,0.9786753459322994,0.8814252528821432,COMPLETE
18,-inf,2026-08-26 03:40:44.550250,2026-08-26 03:40:44.824635,0 days 00:00:00.274385,0.11421636701951954,0.16340094360652418,0.2705092596957167,0.9324155933512588,0.058439946873593884,0.024569157504474783,cosine,0.75587224452527,0.3830664442600437,0.8625236553179783,0.4911295016745516,0.7019019698584749,0.7038795777603291,0.315738544948718,0.513186922639242,0.017037300547871947,0.4397767660720648,0.16704119561745728,0.6039195751126238,COMPLETE
19,-inf,2026-08-26 03:40:44.838688,2026-08-26 03:40:45.106491,0 days 00:00:00.267803,0.2922850925468365,0.45652857769381494,0.14842454283997297,0.8933601708780515,1.1621512433518668,0.052261155320477086,sqrt,0.9603642543868319,0.5922354194776253,0.961200150313781,1.1280508515934422,0.817542394582669,0.4440709557670267,0.0014940194582688804,0.6516878345112224,0.9259154206468075,0.27775193099380047,0.38942030418035145,0.7509290788893702,COMPLETE
20,-inf,2026-08-26 03:40:45.121215,2026-08-26 03:40:45.395039,0 days 00:00:00.273824,0.03354466594539238,0.3651586246172899,0.31176145647029735,0.703979855128787,1.980940687325425,0.007612193255946557,none,0.9985591619950356,0.8204715625069392,0.7568748548619785,0.8732314583800742,0.603532015781172,0.5394118864294095,0.515489425045214,0.3668538206297179,0.7712090906150659,0.14932286423311347,0.6178757768315014,0.5431516201411104,COMPLETE
21,-inf,2026-08-26 03:40:45.417804,2026-08-26 03:40:45.695084,0 days 00:00:00.277280,0.4117805126638424,0.5806059096362691,0.38927079081384053,0.45009081369969284,1.6318027636844772,0.04992765146849176,none,0.7387179371242001,0.39918066456687906,0.1669992658612292,0.05095548099929071,0.8881313048445139,0.03212601494397607,0.41072928301075873,0.436555387876057,0.9858841444336918,0.8479344609434031,0.877353574383583,0.46328118496298637,COMPLETE
22,-inf,2026-08-26 03:40:45.710548,2026-08-26 03:40:45.978278,0 days 00:00:00.267730,0.19831529063993292,0.611704380898305,0.4351267057021182,0.4100260077961118,1.708731074646679,0.06368371867781632,none,0.8710748258122297,0.65005707719466,0.17458541585014836,0.28313872650953564,0.8843446410214542,0.10817294761236963,0.46995160741338343,0.3401354249444603,0.9680059957928299,0.5973959497950966,0.7886029205346176,0.5320222405907291,COMPLETE
23,-inf,2026-08-26 03:40:45.992530,2026-08-26 03:40:46.238306,0 days 00:00:00.245776,0.30239674064960154,0.5145708142566611,0.3397010543841861,0.2025578487148241,1.8016939487812318,0.03954173640787359,none,0.7531956793967767,0.5133308592709545,0.22710073984131277,0.7118266580231479,0.9980589763347958,0.06107408545448738,0.2682272317580128,0.4943891297778266,0.9906097497103176,0.8079317016594179,0.9830538327785254,0.35921093120307246,COMPLETE
24,-inf,2026-08-26 03:40:46.252256,2026-08-26 03:40:46.506704,0 days 00:00:00.254448,0.1200381172566416,0.6982017317079812,0.16012661101010134,0.5082304787676345,1.47363105518318,0.0697480257921643,none,0.7163868554785305,0.3278911155725599,0.024720411148966115,0.035517826073878656,0.769658443167473,0.2522421549447419,0.37827122991852336,0.42943154946113493,0.9085079659074231,0.9825240262970406,0.8543339265055536,0.4602885147734509,COMPLETE
25,-inf,2026-08-26 03:40:46.521234,2026-08-26 03:40:46.782144,0 days 00:00:00.260910,0.46713937142569917,0.37603435574584443,0.48254011078808406,0.8906321113280624,1.8885621571353823,0.02974465271870953,cosine,0.6237312529402202,0.5077563144564485,0.4080703435972812,0.4246379983350083,0.6763245763328286,0.091216969230901,0.58512195003554,0.31218395707368984,0.8390586716346691,0.7755287076103482,0.807627554819907,0.68792854023295,COMPLETE
26,-inf,2026-08-26 03:40:46.805309,2026-08-26 03:40:47.088136,0 days 00:00:00.282827,0.0006393922979750777,0.10060575552700446,0.26603250420023977,0.568783883152924,1.725587462685788,0.05243098925673291,none,0.8238254054930055,0.36138224672951424,0.27863031738273114,0.5432494781399205,0.8413889703259833,0.1637134180227523,0.11444731299367572,0.6167404828935467,0.7596027976641675,0.4563508598827808,0.6750445874638589,0.5653770247997417,COMPLETE
27,-inf,2026-08-26 03:40:47.110915,2026-08-26 03:40:47.391689,0 days 00:00:00.280774,0.15718812438338753,0.2051970707461685,0.01506003529113166,0.6657448566272769,1.5789951703763285,0.019070494914055627,none,0.8555354303741016,0.7312992091386934,0.5130102681278461,0.39469004670726554,0.753456988786679,0.03247050215890351,0.23282562254272507,0.504567944850633,0.8880604750065415,0.607676207595934,0.7975245383668167,0.8439848095635356,COMPLETE
28,-inf,2026-08-26 03:40:47.405989,2026-08-26 03:40:47.679670,0 days 00:00:00.273681,0.24297882660752576,0.077230397527841,0.366479527201297,0.710819824039636,1.8335989739354224,0.09732876894785511,sqrt,0.9155491621183889,0.628159706610826,0.11117879068273778,0.6700924879218038,0.9282748060894412,0.012984414858462925,0.35119776569695577,0.38594753359251494,0.9896142632534137,0.889139687816733,0.9365553190299056,0.6781103088401098,COMPLETE
29,-inf,2026-08-26 03:40:47.694476,2026-08-26 03:40:47.960686,0 days 00:00:00.266210,0.3786115349217055,0.17627368076306515,0.5766071032556754,0.8213954042847238,1.2647382114245875,0.03681001857802805,cosine,0.5291573873004554,0.2720302474403191,0.31202029492401295,0.7968922014773726,0.668110136780745,0.10774768889895965,0.21298730787972459,0.70470135964258,0.6946505937064945,0.7456709558259248,0.6844822578094728,0.30774361534075,COMPLETE
30,-inf,2026-08-26 03:40:47.975019,2026-08-26 03:40:48.276458,0 days 00:00:00.301439,0.3581807979334829,0.015704726627209745,0.6611662391655769,0.40398254937841294,1.1129900609825993,0.032067323924517804,cosine,0.778313436752653,0.558717944502208,0.39511194057466664,0.7459520295438893,0.556929794924132,0.23562048506671898,0.23636890702069352,0.22154451476545298,0.7965433920824676,0.7738799147194461,0.6137582672906056,0.42955933365720317,COMPLETE
31,-inf,2026-08-26 03:40:48.298673,2026-08-26 03:40:48.626401,0 days 00:00:00.327728,0.4412377543127093,0.719159299077296,0.7648751285561857,0.7641523205111653,1.5879605476018863,0.04158882773905421,cosine,0.5799686453844353,0.4595931747050286,0.5642235420370332,0.5897810417888456,0.6539835652416703,0.5572876587118734,0.10090271905229813,0.8123531077447742,0.8782189135574023,0.012858859815252532,0.46257981923347347,0.25190289884400463,COMPLETE
32,-inf,2026-08-26 03:40:48.640936,2026-08-26 03:40:48.903712,0 days 00:00:00.262776,0.09236866478249695,0.9846159531173548,0.4296020908219555,0.8062721438077701,1.226469498584628,0.0667322741667792,cosine,0.6948981381089447,0.30610345799370675,0.6165164251830126,1.21394166146775,0.7032347778721969,0.6178091902217537,0.14005821595783363,0.6476527620487019,0.7099208269647574,0.1271228643414167,0.5760702726762337,0.017434350324052328,COMPLETE
33,-inf,2026-08-26 03:40:48.918271,2026-08-26 03:40:49.176209,0 days 00:00:00.257938,0.5080071479866692,0.821689915085017,0.11062392072505928,0.7722018168718242,1.307988121673543,0.023815757528058742,cosine,0.712302232932468,0.17695615141089116,0.6417848430413767,0.7760867591483034,0.7986341479251128,0.6565981774386015,0.3043793110226535,0.7842496233144816,0.819604571196209,0.1871677275800918,0.49043851071111294,0.26671390754133895,COMPLETE
34,-inf,2026-08-26 03:40:49.190806,2026-08-26 03:40:49.452261,0 days 00:00:00.261455,0.34231224950330785,0.6446379959705582,0.20823160344037328,0.9297977273194498,1.0958943071463447,0.07882364191037226,cosine,0.5997470164786907,0.250497342652465,0.48989229020391095,0.8858889102241337,0.6477021922725255,0.734844271583031,0.1689112913003044,0.5792929124319159,0.9167943926210009,0.3136085631021646,0.44075539283389265,0.37893796446688144,COMPLETE
35,-inf,2026-08-26 03:40:49.474464,2026-08-26 03:40:49.747363,0 days 00:00:00.272899,0.2793303016896835,0.7829936285409491,0.3573308161064746,0.8707583679286077,0.990078526592708,0.04480942422111139,cosine,0.4739071567597384,0.040149271462180836,0.25842749074452886,0.9714005527250711,0.7406064991927219,0.16426509673491257,0.4352480887333097,0.7051619750297796,0.5905422706937824,0.30652425690488216,0.5556810008069275,0.20482448214652468,COMPLETE
36,-inf,2026-08-26 03:40:49.769985,2026-08-26 03:40:50.059283,0 days 00:00:00.289298,0.40277039427669015,0.8953424644131198,0.09195795333292607,0.6645077428491704,1.5297277656552104,0.05819652706400862,cosine,0.6710522791481042,0.11660793445965492,0.36312602415266204,1.3752777154907114,0.537532725116767,0.763363315143239,0.3370316388034718,0.8351525698189224,0.7153991517312291,0.3793281701787205,0.6210598936469657,0.15894480633801483,COMPLETE
37,-inf,2026-08-26 03:40:50.073848,2026-08-26 03:40:50.345819,0 days 00:00:00.271971,0.5033300228151997,0.13401666213188645,0.2774679210721238,0.7773400892363229,1.3724361286550195,0.03355574668815801,none,0.6455236305263218,0.18219511625907883,0.41781758484485654,0.3376541088352419,0.4882090241609038,0.6125470377189483,0.25602088852820154,0.6954547335428446,0.8154570389589868,0.09742187664600688,0.737972323055812,0.3050591539063596,COMPLETE
38,-inf,2026-08-26 03:40:50.360522,2026-08-26 03:40:50.626657,0 days 00:00:00.266135,0.168396832332241,0.7676524948432822,0.7569140505689409,0.8314001119221466,1.7047685933417946,0.08399058789217621,sqrt,0.42544801412645306,0.09616354185422893,0.47433465642964945,0.9526600250172854,0.6408096242911331,0.46595930961055326,0.4293641443737243,0.8898620195047038,0.5468853831155698,0.15744707111539352,0.8454764350718352,0.4931788279037426,COMPLETE
39,-inf,2026-08-26 03:40:50.641141,2026-08-26 03:40:50.899289,0 days 00:00:00.258148,0.07542952638531332,0.869398604115134,0.09408897299233165,0.27814841443353294,0.8255112772588346,0.022006019467855888,cosine,0.5381223987567262,0.3250631367477956,0.5738708443063711,0.1686831155037588,0.7882439399887352,0.363908520252835,0.35985622306011794,0.7695019119062863,0.8935024715999127,0.21866936638517342,0.9070341693234717,0.37234299557102557,COMPLETE
40,-inf,2026-08-26 03:40:50.913925,2026-08-26 03:40:51.193917,0 days 00:00:00.279992,0.3475324939550963,0.9854432171475337,0.19295809202037187,0.8449536827304333,1.8893831388576758,0.014472863644449475,none,0.6679751021964982,0.22324685346508877,0.9960420736502344,0.6491644340472112,0.7165905670625896,0.44008405771257086,0.21152059317319294,0.3964336755993341,0.7410719504050352,0.9071975625399985,0.5219187232581138,0.5749482706860871,COMPLETE
41,-inf,2026-08-26 03:40:51.209491,2026-08-26 03:40:51.486941,0 days 00:00:00.277450,0.5457612526547513,0.2607058296264402,0.4220002704669011,0.9513517980955337,1.6549597033850492,0.011759948720771133,cosine,0.9167366262503653,0.4592370254650442,0.6869256698208692,1.255468085921957,0.39331823752237005,0.7964752761420875,0.09096600469096223,0.467949616189766,0.664347735296026,0.5558445901234098,0.40232268758917566,0.05214977565370495,COMPLETE
42,-inf,2026-08-26 03:40:51.501244,2026-08-26 03:40:51.762100,0 days 00:00:00.260856,0.6242996028680428,0.11621176893736423,0.4738279354559777,0.7412697413885706,1.4966053850035408,0.019363606421272904,cosine,0.8329669936822063,0.6868990235932949,0.744244847214262,1.3551913377810982,0.5962590785216995,0.4057042407872502,0.27873247327188067,0.5513188627879019,0.9372790571384714,0.48952862238989264,0.21610209663236463,0.11053731738313313,COMPLETE
43,-inf,2026-08-26 03:40:51.776463,2026-08-26 03:40:52.045527,0 days 00:00:00.269064,0.44562757842787576,0.32054865045271763,0.39164971154752976,0.918297397000986,1.7799196677675206,0.00995222834037223,cosine,0.7768721901842175,0.6190689028685934,0.807807524123595,1.1261250923306099,0.45490869730589717,0.503237811256025,0.08615216074347234,0.4094211312994882,0.8615261115577357,0.6271253109039712,0.2543938105068594,0.20117020825162502,COMPLETE
44,-inf,2026-08-26 03:40:52.059738,2026-08-26 03:40:52.316707,0 days 00:00:00.256969,0.569633652145405,0.20657325382483058,0.23426398709291324,0.9859030484474837,0.19090378178010298,0.029005246717104055,cosine,0.8421603128215525,0.28282915090902455,0.5320678084266323,1.48021136198785,0.6158118781357887,0.30447479837469665,0.1860441822406756,0.27412775310704096,0.7878126611254737,0.543994833864364,0.31917131840447255,0.09701507087386535,COMPLETE
45,-inf,2026-08-26 03:40:52.331403,2026-08-26 03:40:52.600821,0 days 00:00:00.269418,0.7057218400878714,0.9172884132930346,0.542715590130668,0.8621158021064067,1.9936505744202981,0.04390184579125362,none,0.7921026929130802,0.5158816249104418,0.639276681700427,0.5528589841159918,0.5727892399200365,0.19339901942677776,0.03583132563681679,0.3722301444630374,0.9326617815962159,0.7157525555911817,0.12493480762925924,0.14790035440818788,COMPLETE
46,-inf,2026-08-26 03:40:52.623606,2026-08-26 03:40:52.940984,0 days 00:00:00.317378,0.4153216205875771,0.23854758224433936,0.3134517782630991,0.604165240832029,1.405806089588657,0.016236257135954075,sqrt,0.8703912552017551,0.3594539145593866,0.444994514354739,0.9387347421366401,0.8344418429546037,0.5840042693800885,0.14039222566175658,0.4610328630179755,0.8680875481742584,0.6548664779121618,0.08475187895009612,0.25901537880074454,COMPLETE
